id, additionalDetails, descriptionId
1,Amet ipsa quaerat velit quisquam id nisi. Doloremque natus deserunt voluptas ea velit velit aut. Necessitatibus atque mollitia et quos est. Est tempora eos ea itaque et. Et vel ducimus quam.,100
2,Rerum hic numquam rerum aliquam deserunt et. Omnis sunt voluptates est aliquam maiores nobis aliquid. Atque nisi quaerat sunt voluptate eum. Id earum aliquid cupiditate sint.,101
3,Labore totam consectetur. Illo ex nostrum sint aut quasi aut facilis qui. Praesentium dolores eaque est error aspernatur. Aliquid tenetur est. Quo tempore suscipit. Eligendi veritatis ut sed repudiandae.,102
4,Aperiam corporis quae omnis officiis voluptatem. Voluptatem unde eveniet quia. Quo repudiandae veniam.,103
5,Dolorum expedita autem. Nam nemo ipsum. Quam voluptatem sit odit ipsum consequatur rerum ipsam dolorum ut. Voluptatem ut quod enim et accusamus esse aliquid accusamus. Vitae occaecati sunt soluta sint cupiditate dolor. Cum sunt est fugit consequatur ad enim.,104
6,Fugiat in cum porro sunt sint aut. Reiciendis earum quia molestias illum architecto suscipit nesciunt consequatur nesciunt. Id ut et et. Excepturi tempore omnis asperiores laborum quia maiores qui qui. Quo perspiciatis est est beatae a et. Nostrum omnis quia ipsam.,105
7,Quam neque veritatis aliquam dicta rerum delectus. Impedit minima deleniti. Occaecati delectus dolores animi velit vel ea sed harum ut. Sint dolores harum debitis aspernatur. Numquam ipsum a esse voluptate et nobis sequi doloremque aut. Perspiciatis sequi veritatis atque in blanditiis et quo ducimus labore.,106
8,Sed sit pariatur neque deserunt culpa. Quia architecto reiciendis sequi iure. At sint totam eum vero ut voluptatem atque aut voluptatem. Assumenda corrupti aspernatur. Quia voluptatibus explicabo maiores velit facere. Delectus et aut ea quaerat quaerat.,107
9,Eos aut sit expedita quas itaque deserunt dicta laudantium. Sint consequatur nihil omnis voluptas. Numquam cumque non minima neque sunt et officiis.,108
10,Vel similique molestiae rem voluptas sit minima id velit. Tempora aut velit. A excepturi corrupti corrupti enim est. Delectus ut est.,109
11,Repudiandae omnis non dolor excepturi voluptatem et sed et beatae. Voluptatem aut atque laborum autem. Repellendus totam quaerat qui perspiciatis et tempore temporibus. Id blanditiis sunt nostrum sunt. Enim nesciunt consequatur. Ea id ducimus autem ex sed nesciunt quo ut.,110
12,Inventore doloremque in incidunt quia optio in vel. Quibusdam est molestiae sed possimus illo. Explicabo aspernatur molestiae nobis dolorem fuga veritatis blanditiis debitis. Ratione qui enim. In nulla consequuntur. Ad temporibus voluptatem optio deleniti autem rerum deleniti maxime.,111
13,Est voluptas ab accusamus libero. Laudantium ipsum sit. Possimus qui sit placeat eum laborum. Repudiandae aperiam rerum sequi et nihil qui. Est veritatis vitae officia laudantium distinctio fugit molestiae.,112
14,Ut rerum accusantium. Aut accusamus animi molestias et impedit optio a. Nulla hic assumenda ut ut tempora fugiat ea deserunt aut. Sint alias doloribus est laboriosam eos quia magni nihil qui. Corrupti dolorem expedita minus assumenda occaecati ipsum qui aut eos.,113
15,Vel dolorum quas sequi exercitationem ut est aperiam doloremque. Necessitatibus tempora neque. In fugiat nostrum aut deserunt eos placeat nobis dolor ut.,114
16,Est eveniet quia id beatae consequuntur explicabo. Ullam fugit et asperiores. Omnis soluta nesciunt accusantium quia ea eos in autem provident. Ad neque nihil at et nulla. Quis iste vero vitae voluptate quia ut tenetur et laudantium. Aliquid ipsam repellendus totam voluptates sit nihil adipisci vitae.,115
17,Earum quas qui consequatur est voluptas. Blanditiis illo aut corporis. Quasi et voluptate deserunt qui. Tenetur iusto at voluptates ratione repellat vel. Vel totam possimus illum voluptatem.,116
18,Fugiat vero est accusantium libero rerum rem rerum neque. Facere dolore vel. Incidunt ut non aut cumque ducimus rerum est.,117
19,Praesentium esse ratione quia et fugiat sit occaecati. Ipsam aut tenetur et. Repellat qui sunt fuga assumenda. Quod adipisci sit temporibus recusandae.,118
20,Sed odit quidem quas quia ut sit itaque tenetur temporibus. Sunt molestiae quis eligendi hic libero rerum. Ratione ad cum qui aliquam.,119
21,Alias odio qui autem maiores. Labore impedit nemo quae consectetur qui modi rerum. Officia atque omnis voluptatem vitae quasi in ut. Explicabo consequatur necessitatibus occaecati ab at nobis voluptatibus est sapiente. Eveniet animi quos facere non ex eos. Aut quasi non architecto voluptas eos sit.,120
22,A dicta architecto numquam libero nihil. Optio ut at sed tenetur exercitationem ducimus. Dolorum molestiae asperiores alias omnis est quo dicta. Ea voluptates aut maiores molestias. Maiores cumque amet et.,121
23,Necessitatibus sed voluptatem possimus cum soluta id sunt aspernatur. Laboriosam totam quae consequatur labore maxime et suscipit in nam. Nulla officia aut atque quo et.,122
24,In nihil aperiam qui fugiat. Aut quas voluptatem possimus facilis voluptatibus eveniet et et velit. Ex cumque similique voluptatem deserunt dolore. Fugiat dolor porro. Aliquam dolore omnis. Ab pariatur fugiat itaque iusto ad eum.,123
25,Ad animi vitae animi qui. Omnis voluptates distinctio repellendus ea est delectus distinctio vel. Fugiat fugit ipsam enim et nemo aut officia minima.,124
26,Quidem suscipit non nostrum voluptas. Est illo eum in dolorem quisquam aut quis in dolore. Aliquid repellat incidunt voluptatem. Aliquam consequuntur magnam repellat natus. Aut ducimus facere dolorem sapiente omnis eum perferendis nesciunt fuga. Cupiditate dolor sit cupiditate voluptas repellendus.,125
27,Consequatur voluptas aperiam voluptatem. Error quis aut sapiente. Nostrum porro facere eligendi quos quis sequi ut et aperiam. Rerum ipsam sequi et molestiae quo vero eligendi aspernatur omnis. Ut error voluptatibus nam cumque sed cupiditate dolore culpa et. Omnis at ullam rerum.,126
28,Molestiae error ut eaque laborum. Non sint consectetur possimus amet consectetur accusamus officiis. Animi culpa necessitatibus ut velit sit similique. Et at a sunt voluptatem ut. Illum et repudiandae sit labore pariatur. Explicabo rerum praesentium labore nesciunt doloremque earum rem asperiores quia.,127
29,Quasi et quaerat tempore. Est sint ut nisi voluptatem quos. Deleniti omnis quas vel expedita sint repellat qui.,128
30,Nobis et officia eum enim ipsa debitis vero magni. Sunt nihil nihil voluptatem non omnis aliquid enim eos ab. Quam qui veniam cum. Molestias facere voluptatibus qui eum voluptatem et est. Et repellat iure et quod voluptatibus. Sit eligendi corrupti et id harum ea temporibus velit.,129
31,Fuga quas optio qui cum quia illo adipisci. Ducimus repudiandae nam non est quis qui. Voluptatibus nesciunt velit voluptas amet non dolore ea sed officia. Quibusdam vero incidunt aliquid est quisquam aut est consequatur id. Eaque eum voluptatem nihil rem occaecati voluptatem odit aliquam quam. Possimus itaque sed itaque voluptas provident tenetur.,130
32,Quis tempore commodi inventore qui nihil et qui. Deserunt ut esse ipsa sed fugit. Rem incidunt doloremque ab est quasi unde rerum.,131
33,Molestiae magnam omnis repellat repellat rerum sed fugit. Blanditiis repellat tempore nisi. Tempore sint sit ipsam optio vel voluptatem. Placeat nam vel ut officiis velit quasi at et blanditiis. Id deserunt accusamus velit eum ut placeat. Animi eligendi ad explicabo nisi saepe repellendus et fuga.,132
34,Sunt minima veritatis. Nobis explicabo et odio et earum unde veniam sunt qui. Repellat molestiae voluptas veniam deleniti quis.,133
35,Ut voluptatibus aut ipsa suscipit. Facilis reprehenderit eos minima adipisci voluptas et. Sed hic tempore sit. Tempora voluptatum maxime mollitia. Et praesentium placeat culpa nobis expedita dolorem magnam consequatur explicabo. Ducimus in nemo.,134
36,Dignissimos consequuntur quis saepe totam sed itaque. Beatae suscipit sed repellat ut animi cupiditate quia assumenda. Aut illum officia expedita sit excepturi repudiandae. Maiores omnis soluta sit. Odit nulla qui qui molestiae id tempora rerum eum iure.,135
37,Soluta aperiam consequatur molestiae omnis. Quaerat perspiciatis reiciendis. Inventore quos eum error. Non saepe mollitia harum mollitia voluptatem dolorem debitis accusantium. Illum alias voluptas veniam rem minima.,136
38,Voluptas aut tenetur nihil qui voluptas id sed vel in. Ea eius id hic repudiandae. Dolore eos mollitia nobis dignissimos voluptate ea et consequuntur. Vero voluptate dicta distinctio nisi. Est incidunt nulla velit et nesciunt odit non nesciunt. Magnam possimus officia quam distinctio eos.,137
39,Animi enim similique hic architecto quia aliquid et sed. Quo fuga quas. Ut odio esse adipisci id nisi facere quaerat. Enim nihil ea doloremque minus non ipsa. Deserunt et dolorem sed cum et autem. Non in rerum architecto dolores id qui.,138
40,Nulla nostrum quo quam consequuntur voluptatem et. Perspiciatis itaque unde et quos. Doloribus ut rem et. Tempora animi veritatis consequatur.,139
41,Est incidunt pariatur velit necessitatibus cupiditate nam. Rerum id et maxime eos placeat. Recusandae accusantium velit et. Recusandae sit fugiat debitis voluptate molestiae vero vel sunt. Dolore omnis ex nulla error et sit culpa amet.,140
42,Animi et qui quia quaerat voluptatem quo accusantium. Dolor quaerat aut omnis eum vitae sint cum. Et ut omnis quod nam aut et fuga vero.,141
43,Dicta sed dolores quis sed est omnis voluptas. Perspiciatis voluptatem in accusamus. Qui tempora doloremque. Praesentium consequatur illum similique dolore sit quia.,142
44,Est saepe repellat ipsa qui similique qui. Earum non similique alias esse. Aut fugit dolor praesentium labore qui aut.,143
45,Maxime blanditiis omnis occaecati eum. Ut occaecati et. Eius sunt qui aut ea libero et. Dolor magnam quia a error occaecati.,144
46,Ut corrupti aspernatur iure numquam autem expedita velit doloribus. Nostrum aut adipisci ducimus cumque soluta aut. Quos id omnis. Tempore non consequuntur. Harum ut ut sapiente ducimus laboriosam sit. Possimus voluptatibus ducimus rerum tempora ut ullam dolorem.,145
47,Exercitationem dolores quo voluptas culpa debitis repellendus hic esse. Dolorem laboriosam cum facere. Nam eum aut incidunt saepe voluptas. Aut delectus enim vero ipsam nobis qui illo deleniti mollitia. Et qui rerum. Ex aliquam tempora corrupti similique quo laborum est itaque dignissimos.,146
48,Nemo deleniti quisquam voluptatem nihil sit. Deserunt eaque commodi ut in corporis consectetur. Vero qui voluptas excepturi.,147
49,Labore nulla ratione aspernatur dignissimos in nobis perspiciatis consequatur. A iure temporibus est molestiae non consequatur. Molestiae aliquid nisi nihil similique nobis provident. Minus voluptatem dolores aut vitae impedit exercitationem qui. Sit est voluptas qui. Laborum maxime rerum autem aut iure ullam.,148
50,Id nihil nobis veritatis et doloribus omnis similique doloremque ducimus. Velit eaque et nihil. Eos quis impedit reiciendis reprehenderit deleniti non debitis deserunt. Iusto nam eveniet qui eum rem labore ipsam vitae quia. Dolor suscipit nemo. Quia officiis dolor esse exercitationem sunt maiores.,149
