"Generic Steel Chicken","Libero accusamus officiis et consectetur. Adipisci vel voluptatem et iusto. Consequuntur quaerat cum voluptatem totam molestiae fuga illum. Molestias earum cumque laboriosam corrupti tempora. Vel soluta distinctio repellat.",178732,"Koss - Denesik", "Ships In 5 Business Days", 100
"Tasty Metal Fish","Culpa molestiae praesentium. Corrupti voluptatem placeat sed voluptatum veritatis quo alias ducimus eligendi.",6342017,"Ledner and Sons", "Ships In 0 Business Days", 101
"Small Rubber Salad","Accusantium qui officiis nihil hic dolor. Provident molestias eos neque et. Maxime ut tempore non ipsum unde suscipit reiciendis debitis odio. Omnis qui quia laborum nihil. Porro aut corrupti id nihil. Quasi eligendi facilis debitis.",120958,"Schultz Inc", "Ships In 7 Business Days", 102
"Rustic Wooden Cheese","Placeat necessitatibus similique dignissimos alias voluptatibus nisi voluptatem natus. Praesentium modi minima ipsum voluptas. Ut reprehenderit commodi nihil consequatur nulla debitis aut sit voluptatum. Enim et ab non. Pariatur suscipit id deserunt velit illum et.",3550271,"Jenkins, Gerlach and Halvorson", "Ships In 1 Business Days", 103
"Fantastic Fresh Tuna","Animi qui esse vero eligendi enim rerum officia. Illum beatae exercitationem quia qui blanditiis dolores.",1449991,"Lockman and Sons", "Ships In 1 Business Days", 104
"Rustic Soft Table","Voluptatum est amet sapiente ut quasi commodi. Ut deserunt ab. Eaque totam qui molestiae explicabo et quo corporis quod maxime. Natus velit nulla rerum beatae illo nobis.",6602564,"Reinger - Waelchi", "Ships In 8 Business Days", 105
"Refined Fresh Fish","Quis error asperiores aspernatur vero dolorem velit provident nulla ut. Aliquid veniam earum et et error doloremque quos.",8263532,"Jacobi - Green", "Ships In 8 Business Days", 106
"Practical Wooden Car","Est inventore sunt vel vel rerum qui. Est cumque omnis molestiae quia ratione qui. Recusandae voluptate sint fuga voluptatibus rerum qui.",6508961,"Gaylord, Bahringer and Heathcote", "Ships In 8 Business Days", 107
"Practical Soft Cheese","Iure ullam et sit aperiam et. Illo quae harum modi aut esse autem et nam. Non corrupti consequuntur sed. Accusamus quos vel velit aliquam totam voluptatem qui voluptates debitis. Odit suscipit vel occaecati corporis. Provident quos non dignissimos.",1935584,"Boyer Group", "Ships In 4 Business Days", 108
"Intelligent Metal Gloves","Placeat voluptatem eum commodi necessitatibus non voluptatem. Sunt qui fuga dolorum similique aut consequatur. Velit illum incidunt aliquid ut corporis quaerat. Et consequatur repellat maiores libero beatae assumenda eos id.",1361118,"Dare Inc", "Ships In 2 Business Days", 109
"Practical Plastic Keyboard","Asperiores aperiam possimus nostrum exercitationem et asperiores dolorum ratione. Autem porro inventore et fugiat veritatis aut nesciunt ipsum eos.",9869474,"Wiza LLC", "Ships In 5 Business Days", 110
"Practical Cotton Bike","Quidem iste ea sint ipsa magnam. Inventore vitae deleniti temporibus et est et facilis aliquam. Ea minima assumenda quasi eos vel sit.",4814364,"Schowalter, Russel and Green", "Ships In 3 Business Days", 111
"Incredible Plastic Shirt","Consequuntur sint placeat eveniet ad magni repellat ut dolore eligendi. Et neque quia veniam ut quo architecto excepturi rem. Dignissimos quaerat consequatur ex nemo. Alias et quae. Sapiente repudiandae maxime sint explicabo qui adipisci laudantium voluptas sit. Exercitationem cupiditate dolorem magni ducimus sit illum.",2650700,"Friesen - Kiehn", "Ships In 6 Business Days", 112
"Handmade Frozen Table","Distinctio sed est. Quo tempora eos nulla et illo ut saepe nihil omnis.",3820983,"Langosh LLC", "Ships In 1 Business Days", 113
"Handmade Cotton Towels","Facilis modi ut ab quibusdam deleniti asperiores quos sint. Adipisci corporis sit perspiciatis qui voluptas quia. Voluptate consequatur facere veniam autem ex. Et aliquam ullam odit aut officia aut sint est.",8472284,"Stiedemann - Baumbach", "Ships In 4 Business Days", 114
"Sleek Rubber Soap","Sit vero harum cupiditate soluta velit quis et rerum dolor. Deleniti ut autem accusamus.",3871256,"Shanahan - Stehr", "Ships In 6 Business Days", 115
"Ergonomic Cotton Cheese","Sit error dolorum distinctio. Dicta eligendi in consectetur nulla. Consequatur rem pariatur sapiente voluptas. Est quos eaque est excepturi alias ea voluptas. Deleniti dolorum veniam velit dolores voluptatem ut quia molestiae commodi.",4386625,"Kirlin - Smith", "Ships In 6 Business Days", 116
"Ergonomic Plastic Keyboard","Earum fugiat non. Non maiores voluptatem. Est dolore reiciendis et nesciunt excepturi soluta fugit. Suscipit harum sunt eum ullam. Quam asperiores eligendi voluptatem odit quia nostrum et aliquam et. Voluptas necessitatibus in est sit odit sed.",1881098,"Ritchie - Koch", "Ships In 7 Business Days", 117
"Ergonomic Rubber Fish","Illo ad officia quasi incidunt. Aut nesciunt odit. Sit sit voluptatem delectus excepturi consequatur odit.",5564065,"Gottlieb and Sons", "Ships In 9 Business Days", 118
"Awesome Granite Cheese","Optio nisi eum eos nisi ut sint tempore reiciendis ut. Sapiente suscipit repudiandae nobis est nostrum voluptas nihil illo. Est impedit perferendis qui natus et. Itaque ut aut qui itaque. Repudiandae aliquam quaerat aliquam doloremque dolor sit sequi.",3478861,"Berge LLC", "Ships In 2 Business Days", 119
"Unbranded Steel Shirt","Rerum architecto ipsa exercitationem et natus non. Qui et fuga ut esse facere quaerat doloribus fugiat accusantium. Harum et placeat corrupti vel ut sequi dolorum nulla. Aut veritatis odit reiciendis et aut quaerat eius rerum. Magni atque omnis id consectetur ea et. Delectus deserunt architecto enim iure iste eius debitis quo.",6268366,"Emmerich, Lang and Collier", "Ships In 4 Business Days", 120
"Fantastic Rubber Bacon","Quisquam incidunt magni animi voluptas et officia ut ducimus. Doloremque est nulla magni quis. Consequatur ut et in saepe accusantium non optio dolorem. Saepe et debitis et maxime quidem consequuntur vel vel. Rerum aperiam corporis nihil sed ut. Sed est eum.",84343,"Herman - Cremin", "Ships In 6 Business Days", 121
"Sleek Steel Bike","Nisi repudiandae aliquid ut reiciendis ab quisquam eligendi praesentium natus. Ut aliquam laborum iusto quis aperiam laboriosam facilis laboriosam eum. Deleniti harum praesentium sunt ut minima ipsum vitae. Sapiente rem distinctio sit voluptas dignissimos et sit. Quae tenetur possimus nihil nostrum eum dicta nam. Consectetur minima aut.",4494829,"Corwin - Mueller", "Ships In 4 Business Days", 122
"Incredible Soft Bacon","Repellat architecto quae eum ut aperiam. Impedit deserunt cum non blanditiis rerum. Et consequatur qui rem voluptatibus aliquid molestiae aut asperiores. Iure velit natus perspiciatis quaerat. Officia rerum quis quaerat asperiores repudiandae.",6978437,"Maggio LLC", "Ships In 7 Business Days", 123
"Gorgeous Soft Car","Veniam vero ullam sit necessitatibus. Voluptate perferendis voluptatum adipisci. Similique qui alias placeat voluptas temporibus ea nulla. Odio illo sit a nesciunt quo excepturi.",2596321,"Connelly Inc", "Ships In 9 Business Days", 124
"Small Concrete Shirt","Eaque est omnis eum sed impedit autem vero assumenda. Ipsa facilis quibusdam.",7607100,"Russel Group", "Ships In 1 Business Days", 125
"Intelligent Frozen Table","Placeat aliquam sapiente ea omnis. Similique voluptate ut cumque debitis quidem sint aut in. Aut reprehenderit voluptatibus perferendis voluptatem ipsum qui aut.",1050281,"Schultz - Ortiz", "Ships In 3 Business Days", 126
"Rustic Soft Pants","Excepturi pariatur mollitia impedit consequatur qui. Et reiciendis veniam. Nihil quia ut saepe mollitia. Error deserunt pariatur.",7916022,"Bergnaum, Kutch and Steuber", "Ships In 4 Business Days", 127
"Ergonomic Soft Shoes","Sit et illum. Quia iusto sed molestiae accusantium harum eum.",3474125,"Ziemann, Monahan and Ritchie", "Ships In 0 Business Days", 128
"Small Frozen Tuna","Veritatis reiciendis dolor rerum. Voluptas vel omnis nemo laboriosam ullam nulla.",1588099,"Hagenes - Shanahan", "Ships In 1 Business Days", 129
"Awesome Rubber Shirt","Est sequi consequatur nesciunt libero ratione distinctio ad impedit. Officiis vitae perspiciatis ut ipsum omnis incidunt.",1071175,"Hickle, Hodkiewicz and Mills", "Ships In 8 Business Days", 130
"Awesome Frozen Bike","Et consequatur impedit ab quibusdam non. Ullam beatae rerum eaque. Consectetur harum maiores. Ut in soluta quae consequatur quam aut necessitatibus ea.",1466029,"Mitchell Group", "Ships In 3 Business Days", 131
"Handcrafted Soft Car","Molestiae consequatur ut aut odio itaque unde quia molestiae debitis. Est saepe sunt recusandae aut voluptates ut.",8115976,"Rolfson - Powlowski", "Ships In 2 Business Days", 132
"Handcrafted Cotton Ball","Aperiam qui a ipsa. Id blanditiis qui quis in.",4225823,"Koepp - Reichert", "Ships In 1 Business Days", 133
"Handmade Cotton Gloves","Aut velit et saepe et quia. A omnis dolores cupiditate tenetur autem et accusantium modi. Vel mollitia voluptatibus soluta rerum temporibus nostrum qui. Earum omnis ullam dolorem est. Ab similique molestias nobis quas voluptatum aliquam. Ea commodi in cupiditate pariatur optio corrupti totam.",5405840,"Larkin, Mertz and Satterfield", "Ships In 3 Business Days", 134
"Tasty Concrete Ball","Dolorum non itaque. Nihil aut veritatis minus et aspernatur adipisci. Quod adipisci voluptatum saepe tenetur. Quibusdam cum officiis voluptates necessitatibus repudiandae itaque. Est ipsum quia ipsa. Rerum nobis molestias cumque.",3928080,"Sanford, Heller and Sanford", "Ships In 0 Business Days", 135
"Generic Concrete Soap","Nesciunt natus alias fugit. Quidem ducimus repellat natus quisquam quos beatae sunt in id.",5702178,"Bechtelar - Ziemann", "Ships In 6 Business Days", 136
"Handmade Granite Ball","Est optio modi iusto et adipisci sed porro eos corporis. Aperiam animi soluta. Deleniti et dolore asperiores.",1954666,"Effertz, Daniel and Weimann", "Ships In 2 Business Days", 137
"Incredible Wooden Fish","Modi aut qui voluptatem nihil porro optio consequatur. Est molestiae totam molestias perspiciatis dolor esse. Libero commodi eaque. Facere eos libero rerum eum. Dolore non itaque quia minima totam.",9619776,"Fay Group", "Ships In 4 Business Days", 138
"Incredible Concrete Chicken","Quo aut eos dolores quae fugit quo. Unde non corporis maxime cupiditate et.",8023261,"Schinner, Schaden and Jenkins", "Ships In 1 Business Days", 139
"Incredible Soft Bike","Fuga consequuntur numquam officia odio. Error cumque architecto quis quia molestias esse. Velit omnis officia sint dolorem possimus. Molestias quia eligendi voluptatem expedita aliquid molestiae non fuga adipisci.",6074941,"Yundt, Reichert and Lockman", "Ships In 7 Business Days", 140
"Sleek Granite Chips","Asperiores enim repellat aspernatur libero nihil fuga aut culpa. Et et accusamus deleniti voluptatibus quaerat aperiam amet sunt. Hic vel fuga qui quia illo qui eaque. Veritatis repellendus delectus voluptas itaque dicta. Minima et corrupti et.",1042197,"Wiza, O'Connell and Lebsack", "Ships In 4 Business Days", 141
"Rustic Soft Chips","Unde vitae consequatur totam. Est quam qui dolorem ex voluptatum autem est. Et iste totam ratione. Sequi repellendus dolore aut.",166799,"Jast LLC", "Ships In 7 Business Days", 142
"Ergonomic Cotton Chair","Voluptatem sed quod exercitationem ea animi. Architecto qui debitis ipsa dignissimos non est. Corporis dolore in. Et omnis aut qui.",5746292,"Dare and Sons", "Ships In 4 Business Days", 143
"Tasty Plastic Chips","Sapiente veritatis possimus. A corrupti impedit eos. Corrupti necessitatibus sit quos.",8899506,"Luettgen LLC", "Ships In 7 Business Days", 144
"Sleek Rubber Tuna","A minus et nesciunt assumenda eos vitae nostrum ut est. Eius reiciendis iure earum alias sapiente aperiam eveniet unde. Et cum aut debitis maxime nulla est possimus accusantium numquam. Qui ullam eos provident.",9570255,"Jacobs and Sons", "Ships In 0 Business Days", 145
"Practical Granite Car","Omnis voluptatibus quidem id at sit nemo consequatur laudantium ipsam. Neque delectus voluptatibus porro et quia ut mollitia. Non ratione quam. Odio fugit autem sed minima perspiciatis quo labore rerum error. Laboriosam commodi impedit similique modi ut et tenetur magni explicabo. Quia modi explicabo quo animi est fuga ipsum rem et.",6121271,"Howell - Greenfelder", "Ships In 2 Business Days", 146
"Sleek Steel Salad","Rerum magnam sint quisquam optio corrupti dolor ipsa sed libero. Eligendi nulla exercitationem eveniet ut. Occaecati quia esse quis ab. Praesentium dolorum numquam consequatur autem facere quia dolorem quia. Quia nobis voluptatem non doloremque cumque molestias animi. Corporis fugit rerum iure a esse quaerat et labore.",2173005,"Leannon Inc", "Ships In 8 Business Days", 147
"Incredible Soft Shoes","Itaque natus esse qui itaque qui minus adipisci ea. Corporis dignissimos dolores ullam maxime accusamus eius. Laboriosam mollitia quaerat aut deserunt explicabo rerum. Exercitationem dolore veritatis a possimus.",4821779,"Mertz - Aufderhar", "Ships In 6 Business Days", 148
"Refined Steel Mouse","Fugiat dolor tempora qui explicabo quasi ut quia non dicta. Dolor similique adipisci sed dolor.",5567746,"Braun Inc", "Ships In 3 Business Days", 149
